{
  "id": "sheet-multiview-16x9",
  "version": "1.0.0",
  "purpose": "character-sheet",
  "media": "image",
  "title": "Three-view orthographic character sheet with accessories",
  "description": "A 16:9 visual aid: front, side and back in A-pose plus the separable accessories laid out as isolated objects.",
  "body": {
    "subject": "A clean orthographic character sheet of {{character_description}}, 16:9 landscape, white background throughout, the same character in the same A-pose in every view with verifiably the same proportions and face.",
    "action": "Three views left to right: FRONT (left third, dead-on), SIDE (middle third, profile 90 degrees to the right, camera sees the character's left side), BACK (right third, directly away from the camera), feet on one ground line. To the right, the separable accessories as ISOLATED objects, each captioned with its name: {{accessory_list}}.",
    "camera": "Orthographic, no perspective, no foreshortening; eye-level; each view complete and uncropped.",
    "style": "Neutral diffuse flat lighting, no shadow on the ground, no cinematic mood; sharp focus, reference-grade clarity.",
    "constraints": "Match the reference exactly across all three projections; no overlapping views; if there are no accessories omit the accessory layout."
  },
  "variables": {
    "character_description": {
      "type": "string",
      "default": "the character in the reference image",
      "description": "gender presentation if obvious, apparent age, art style, key wardrobe, key accessories, colour palette"
    },
    "accessory_list": {
      "type": "string",
      "default": "none",
      "description": "every separable accessory, e.g. the wizard hat, the curved katana"
    }
  },
  "negatives": [
    "no three-quarter view",
    "no body rotation or twist",
    "no hero or dynamic pose",
    "no environment, shadow or rim lighting",
    "no cropped or missing limbs"
  ],
  "provenance": {
    "source": "mr-mak-workspace:.agents/skills/character-sheet-pipeline/prompts/01b_character_sheet.md@1e0c7c3",
    "note": "MIT (Copyright (c) 2026 Mr. Mak Workspace contributors); the wording is adapted to Lampway's five-part body and its five-negative cap (the upstream negative list is shipped as the long-negative variant where it is a tuning question)"
  },
  "inputs": {
    "reference_image": {
      "required": true,
      "order": 1,
      "description": "the user's character image"
    },
    "design_plate": {
      "required": true,
      "order": 2,
      "description": "the accepted strict-front A-pose sheet"
    }
  },
  "defaults": {
    "model": "openai/gpt-image-2.5-sunburst",
    "size": "3840x2160",
    "quality": "high",
    "background": "opaque",
    "n": 1
  },
  "model_adapters": {
    "openai/gpt-image*": {
      "note": "GPT Image wants the reference order stated in prose and takes an explicit size (<= 3840 per edge, ~8.3 MP)"
    },
    "black-forest-labs/*": {
      "note": "takes resolution + aspect_ratio; tolerates shorter prompts"
    },
    "google/gemini*": {
      "note": "takes resolution + aspect_ratio; tolerates shorter prompts"
    },
    "bytedance-seed/*": {
      "note": "takes resolution + aspect_ratio"
    },
    "sourceful/*": {
      "note": "Riverflow: flattest albedo; takes resolution + aspect_ratio"
    }
  },
  "gates": [
    {
      "id": "view_verify",
      "description": "verify the view with lampway_view_verify; a stop after the ladder's ceiling is the user's decision"
    }
  ]
}
