{
  "id": "part-view",
  "version": "1.0.0",
  "purpose": "character-part",
  "media": "image",
  "title": "Part in strict side or back view",
  "description": "A strict orthographic side (exactly 90 degrees) or back (exactly 180) view of a part or the body, the A-pose held. Gated by the user: it multiplies the render count.",
  "body": {
    "subject": "Reference the attached strict-front sheet and the accepted front render of the {{subject_part}}. Render the same {{subject_part}} as a strict orthographic {{angle}} view.",
    "action": "{{angle_rule}} The part and the A-pose are held exactly as in the front view.",
    "camera": "Strict orthographic, no three-quarter, no perspective, same scale and ground line as the front view.",
    "style": "White background, neutral flat lighting; same materials and wear; sharp focus at 2K.",
    "constraints": "The render count is proposed to the user before any multi-view is generated."
  },
  "variables": {
    "angle": {
      "type": "enum",
      "default": "side",
      "enum": [
        "side",
        "back"
      ],
      "description": "the view"
    },
    "subject_part": {
      "type": "string",
      "default": "torso",
      "description": "the part (body, head, hair, accessory)"
    },
    "angle_rule": {
      "type": "string",
      "default": "Side view is exactly a 90 degree profile; back view is exactly 180 degrees, dead-back.",
      "description": "the angle statement"
    }
  },
  "negatives": [
    "no three-quarter view",
    "no body rotation or twist",
    "no hero or dynamic pose",
    "no environment, shadow or rim lighting",
    "no cropped or missing limbs"
  ],
  "provenance": {
    "source": "mr-mak-workspace:.agents/skills/character-sheet-pipeline/prompts/06_multiview.md@1e0c7c3",
    "note": "MIT (Copyright (c) 2026 Mr. Mak Workspace contributors); the wording is adapted to Lampway's five-part body and its five-negative cap (the upstream negative list is shipped as the long-negative variant where it is a tuning question)"
  },
  "inputs": {
    "reference_image": {
      "required": true,
      "order": 1,
      "description": "the strict-front sheet"
    },
    "design_plate": {
      "required": true,
      "order": 2,
      "description": "the accepted front render of the part"
    }
  },
  "defaults": {
    "model": "openai/gpt-image-2.5-sunburst",
    "size": "2048x2048",
    "quality": "high",
    "background": "opaque",
    "n": 1
  },
  "gates": [
    {
      "id": "user_confirms_multiview",
      "description": "propose the render count and wait for the user's answer"
    }
  ],
  "model_adapters": {
    "openai/gpt-image*": {
      "note": "GPT Image wants the reference order stated in prose and takes an explicit size (<= 3840 per edge, ~8.3 MP)"
    },
    "black-forest-labs/*": {
      "note": "takes resolution + aspect_ratio; tolerates shorter prompts"
    },
    "google/gemini*": {
      "note": "takes resolution + aspect_ratio; tolerates shorter prompts"
    },
    "bytedance-seed/*": {
      "note": "takes resolution + aspect_ratio"
    },
    "sourceful/*": {
      "note": "Riverflow: flattest albedo; takes resolution + aspect_ratio"
    }
  }
}
