{
  "id": "moodboard-armor-adaptation",
  "version": "1.0.0",
  "purpose": "character-sheet",
  "media": "image",
  "title": "Armor adaptation sheet: the armor design onto the exact MetaHuman body",
  "description": "Moodboard P2: how the concept armor translates onto the actual MetaHuman body (a hero render plus front and side orthographic views).",
  "body": {
    "subject": "Create a photorealistic armor adaptation sheet using the attached references. Image A is the exact MetaHuman anatomy and body-proportion reference. Image B is the armor design reference only.",
    "action": "Adapt the armor from Image B onto the exact MetaHuman body from Image A. Preserve the MetaHuman's identity, face, body proportions, shoulder width, torso depth, arm length, pelvis width, leg proportions, hand size, and foot size. Do not replace the body with a larger, more muscular, or differently proportioned heroic figure. The MetaHuman anatomy must remain the foundation. Preserve the armor design language from Image B: materials, colors, motifs, engravings, silhouette language, trim, cape treatment, weapon style, shield style, and overall aesthetic. However, resize and reshape every armor component so it appears believable and wearable on the MetaHuman body from Image A.",
    "camera": "Create a clean design-evaluation sheet with: one large full-body hero render of the armored MetaHuman on the left; two smaller supporting views on the right: front orthographic and side orthographic; optional small back view if space allows.",
    "style": "Presentation requirements: clean neutral background; no cinematic scenery; no decorative borders; soft studio lighting; high photorealism.",
    "constraints": "Armor must clearly look fitted to the MetaHuman body; show believable spacing and thickness; no floating armor; no stylized anatomy changes. This is not a final poster. It is a design adaptation and fitting reference showing how the concept armor translates onto the actual MetaHuman body."
  },
  "variables": {},
  "negatives": [],
  "inputs": {
    "character_body": {
      "required": true,
      "order": 1,
      "description": "Image A: the exact MetaHuman anatomy and body-proportion reference (the anatomy sheet)"
    },
    "design_plate": {
      "required": true,
      "order": 2,
      "description": "Image B: the armor design reference only"
    }
  },
  "defaults": {
    "n": 1
  },
  "model_adapters": {
    "openai/gpt-image*": {
      "note": "GPT Image wants the reference order stated in prose and takes an explicit size (<= 3840 per edge, ~8.3 MP)"
    },
    "black-forest-labs/*": {
      "note": "takes resolution + aspect_ratio; tolerates shorter prompts"
    },
    "google/gemini*": {
      "note": "takes resolution + aspect_ratio; tolerates shorter prompts"
    },
    "bytedance-seed/*": {
      "note": "takes resolution + aspect_ratio"
    },
    "sourceful/*": {
      "note": "Riverflow: flattest albedo; takes resolution + aspect_ratio"
    }
  },
  "gates": [
    {
      "id": "view_verify",
      "description": "inspect every result: names and hashes cannot prove a view, a side or a scale"
    }
  ],
  "provenance": {
    "source": "the captain's moodboard prompts (specs/prompts/moodboard/Prompt1-8.txt), 2026-10-06",
    "note": "spruced up into the five-part spine; nothing lost: every original clause is mapped in prompts/moodboard_parity.json and checked by tests/test_moodboard_parity.py"
  }
}
