{
  "id": "anim-split-front-side",
  "version": "1.0.0",
  "purpose": "anim-split",
  "media": "video",
  "title": "Synchronised dual view: front and side",
  "description": "The captain's split-screen prompt: two fixed orthographic cameras, the same motion, frame-level sync.",
  "body": {
    "subject": "Split-screen video with two fixed orthographic cameras showing the same armoured warrior, exactly as in [start_image], at the same moment: left panel the exact front view, right panel the exact side view. {{design_lock}}.",
    "action": "He walks in place at a steady natural pace of {{cadence_spm}} steps per minute, both panels the identical motion, perfectly synchronized.",
    "camera": "Both cameras locked off: no camera movement, no zoom, no cuts, no perspective change.",
    "style": "Flat even studio light, plain light-grey backdrop in both panels.",
    "constraints": "Full body in frame in both panels, feet touching the floor line, exactly two arms and two legs, same armour design in both views."
  },
  "variables": {
    "design_lock": {
      "type": "string",
      "default": "dark bronze plate armour, gold lion-head pauldrons, crimson cloth skirt with a gold meander hem, black undersuit",
      "description": "what must stay unchanged: the design in words"
    },
    "cadence_spm": {
      "type": "integer",
      "default": 110,
      "min": 60,
      "max": 160,
      "description": "steps per minute"
    }
  },
  "negatives": [
    "no camera movement",
    "no zoom",
    "no cuts",
    "no mirrored motion"
  ],
  "inputs": {
    "start_image": {
      "required": true,
      "order": 1,
      "description": "an image showing the front view left and the side view right"
    }
  },
  "defaults": {
    "model": "heygen/heygen-video-1",
    "resolution": "768p",
    "aspect_ratio": "16:9",
    "duration": 10,
    "image_mode": "first_frame"
  },
  "model_adapters": {
    "bytedance/seedance*": {
      "ref_names": {
        "start_image": "the start image",
        "end_image": "the end image",
        "video_reference": "the reference video"
      },
      "note": "names references in prose; roles are start_image / end_image / video references"
    },
    "higgsfield/*": {
      "ref_names": {
        "start_image": "the start image",
        "video_reference": "the reference video"
      },
      "note": "Higgsfield media roles: start_image, end_image, image_references, video_references"
    },
    "heygen/*": {
      "note": "audio is always on and not controllable; only a first frame is taken"
    },
    "kwaivgi/*": {
      "ref_names": {
        "start_image": "the first frame"
      }
    }
  },
  "gates": [
    {
      "id": "panel_sync",
      "description": "frame-level sync between the panels",
      "threshold": 0.95
    },
    {
      "id": "tracking",
      "description": "tracked frames",
      "threshold": 0.9
    }
  ],
  "provenance": {
    "source": "the captain's own tested prompt (Higgsfield 14ca1599, 08aad70d)"
  },
  "root_motion": "none"
}
