{
  "id": "mesh-paint-albedo-side-first",
  "version": "1.0.0",
  "purpose": "albedo",
  "media": "image",
  "title": "Mesh-paint albedo (side view, nothing painted yet)",
  "description": "The first view to paint: no painted view exists yet, so the design plate is the SECOND image (the mesh-paint step's original behaviour).",
  "body": {
    "subject": "The FIRST image is a grey clay render of a 3D armor model seen from one side. The SECOND image is the original colour design of the armor seen from this same side.",
    "action": "Paint the FIRST image: keep every shape of the clay model exactly where it is - same outline, same position, same scale, every plate, lion head, rivet, belt, fold and fringe, pixel for pixel. Do not move, add, remove or redraw any shape; only colour the surfaces that are already there.",
    "camera": "",
    "style": "Colours: {{colours}} Output a flat ALBEDO texture: no lighting, no shadows, no shading, no ambient occlusion, no highlights, no reflections, no gloss - every surface only its flat base colour.",
    "constraints": "Plain flat white background. No text."
  },
  "variables": {
    "colours": {
      "type": "string",
      "default": "warm dark bronze-brown plate metal (not black), antique gold lion heads, trims, rims, rivets and ornaments, crimson red cloth with gold Greek-key embroidery bands at the hems, black linen undersuit, oxblood red leather belt.",
      "description": "the colour scheme"
    }
  },
  "negatives": [],
  "inputs": {
    "clay_render": {
      "required": true,
      "order": 1,
      "description": "the grey clay render of the model"
    },
    "design_plate": {
      "required": true,
      "order": 2,
      "description": "the original colour design from this same view"
    }
  },
  "defaults": {
    "model": "openai/gpt-image-2.5-flare",
    "size": "2880x2880",
    "quality": "high",
    "background": "opaque",
    "n": 4
  },
  "model_adapters": {
    "openai/gpt-image*": {
      "note": "GPT Image wants the reference order stated in prose and takes an explicit size (<= 3840 per edge, ~8.3 MP)"
    },
    "black-forest-labs/*": {
      "note": "takes resolution + aspect_ratio; tolerates shorter prompts"
    },
    "google/gemini*": {
      "note": "takes resolution + aspect_ratio; tolerates shorter prompts"
    },
    "bytedance-seed/*": {
      "note": "takes resolution + aspect_ratio"
    },
    "sourceful/*": {
      "note": "Riverflow: flattest albedo; takes resolution + aspect_ratio"
    }
  },
  "gates": [
    {
      "id": "silhouette_iou",
      "description": "silhouette IoU against the clay render / the V3 alpha (texlib/fidelity.py)",
      "threshold": 0.95
    },
    {
      "id": "structure",
      "description": "structure similarity",
      "threshold": 0.8
    }
  ],
  "provenance": {
    "source": "texlib/prompts/prompt_meshpaint_v2.txt (the shelf), ported verbatim",
    "note": "GPT 2.5 Flare; Riverflow 2.5 Pro for flatter albedo (IoU 0.992 vs clay, dearer and slower) | first-view variant: the SECOND-image sentence is dropped and the plate moves up, as the mesh-paint step always did"
  }
}
