{
  "id": "moodboard-fit-check",
  "version": "1.0.0",
  "purpose": "character-sheet",
  "media": "image",
  "title": "Orthographic armored fit-check sheet (4 views)",
  "description": "Moodboard P3: technical review that the armor fits the MetaHuman in front, side and back views before isolated assets are generated.",
  "body": {
    "subject": "Create a clean orthographic armored fit-check sheet using the attached references. Image A is the exact MetaHuman body reference. Image B is the approved armor-on-body design reference.",
    "action": "Show the MetaHuman wearing the approved armor in four full-body orthographic views: FRONT, LEFT, BACK, and RIGHT. Preserve the exact same body proportions from Image A. The armor must fit this body correctly and consistently in every view. The armor should match the approved design from Image B exactly in materials, details, motifs, silhouette, thickness, and construction. Keep the character's identity and body shape consistent. Do not make the body more heroic, broader, taller, or more muscular.",
    "camera": "Orthographic projection; consistent scale across all four views; full body visible and uncropped.",
    "style": "Presentation requirements: square or portrait sheet; clean neutral background, flat and uniform; no cinematic environment; no shadows; soft even studio lighting.",
    "constraints": "Small simple labels only: FRONT, LEFT, BACK, RIGHT; no decorative poster text. The purpose of this image is technical review: to verify that the armor design actually fits the MetaHuman in front, side, and back views before generating isolated assets."
  },
  "variables": {},
  "negatives": [],
  "inputs": {
    "character_body": {
      "required": true,
      "order": 1,
      "description": "Image A: the exact MetaHuman body reference (the anatomy sheet)"
    },
    "design_plate": {
      "required": true,
      "order": 2,
      "description": "Image B: the approved armor-on-body design reference (the adaptation sheet)"
    }
  },
  "defaults": {
    "n": 1
  },
  "model_adapters": {
    "openai/gpt-image*": {
      "note": "GPT Image wants the reference order stated in prose and takes an explicit size (<= 3840 per edge, ~8.3 MP)"
    },
    "black-forest-labs/*": {
      "note": "takes resolution + aspect_ratio; tolerates shorter prompts"
    },
    "google/gemini*": {
      "note": "takes resolution + aspect_ratio; tolerates shorter prompts"
    },
    "bytedance-seed/*": {
      "note": "takes resolution + aspect_ratio"
    },
    "sourceful/*": {
      "note": "Riverflow: flattest albedo; takes resolution + aspect_ratio"
    }
  },
  "gates": [
    {
      "id": "view_verify",
      "description": "inspect every result: names and hashes cannot prove a view, a side or a scale"
    }
  ],
  "provenance": {
    "source": "the captain's moodboard prompts (specs/prompts/moodboard/Prompt1-8.txt), 2026-10-06",
    "note": "spruced up into the five-part spine; nothing lost: every original clause is mapped in prompts/moodboard_parity.json and checked by tests/test_moodboard_parity.py"
  }
}
